{
  "shot_id": "EP001_S001",
  "activeCharacterTags": [],
  "location_id": "BELL",
  "space_id": "BH-EXT",
  "location_view_id": "MASTER_WIDE",
  "camera_type": "wide",
  "first_frame_action": "One establishing frame of Bell and Leaf House exterior at neutral natural daylight with no visible people.",
  "emotion": [],
  "outfits": {},
  "duration_seconds": 10,
  "dialogue_wav": null
}